{
  "$schema": "http://json-schema.org/draft-07/schema#",
  "title": "Assessment Input (minimal)",
  "type": "object",
  "required": [
    "assessment_date",
    "jurisdiction",
    "language",
    "contract",
    "parties",
    "facts"
  ],
  "properties": {
    "assessment_date": {
      "type": "string"
    },
    "jurisdiction": {
      "type": "string"
    },
    "language": {
      "type": "string"
    },
    "contract": {
      "type": "object"
    },
    "parties": {
      "type": "object"
    },
    "facts": {
      "type": "object"
    }
  }
}